{
  "schema_version": "1.0",
  "application": "toy_missing_auth",
  "framework": "synthetic",
  "metadata": { "purpose": "endpoint with no auth reaches a data-access" },
  "nodes": [
    {
      "id": "ep_dump_users",
      "type": "endpoint",
      "attrs": {
        "http_method": "GET",
        "route": "/api/admin/users/dump",
        "route_params": [],
        "requires_auth": false,
        "required_role": "NONE",
        "is_intentionally_public": false,
        "source_location": "toy_missing_auth/views.py:5"
      }
    },
    {
      "id": "svc_dump",
      "type": "service",
      "attrs": { "name": "UserAdminService.dump", "performs_data_access": true }
    },
    {
      "id": "da_users_read",
      "type": "data_access",
      "attrs": {
        "operation": "READ",
        "target_entity": "User",
        "has_ownership_predicate": false,
        "ownership_predicate_type": "NONE",
        "user_controlled_params_in_query": []
      }
    }
  ],
  "edges": [
    { "src": "ep_dump_users", "dst": "svc_dump", "type": "call" },
    { "src": "svc_dump", "dst": "da_users_read", "type": "call" }
  ],
  "labels": {
    "ep_dump_users": { "label": "VULNERABLE", "subtype": "MISSING_AUTH", "cwe": "CWE-862" }
  }
}
